,text
55,"IPC No corresponding provision in the IPC changes to BNSClause 115 (3) Whoever commits an offence under sub- section (1) and in the course of such commission causes any hurt to a person which causes that person to be in permanent disability or in persistent vegetative state, shall be punished with rigorous imprisonment for a term which shall not be less than ten years but which may extend to imprisonment for life, which shall mean imprisonment for the remainder of that persons
natural life.The Implication of revision is This provision introduces an aggravated form of the offence of grievous hurt, with an increased mandatory minimum sentence of ten years. This would have been punishable previously with a maximum sentence of seven years."
56,"IPC No corresponding provision in the IPC changes to BNSClause115 (4) When grievous hurt of a person is caused by a group of five or more persons on the ground of his, race, caste, sex, place of birth, language, personal belief or any other ground, each member of such group shall be guilty of the offence of causing grievous hurt, and shall be
punished with imprisonmentThe Implication of revision is This clause appears to criminalise participation in the offence wherein grievous hurt is caused by a group on the grounds of race, caste, sex, etc. It is not clear whether there is a requirement of common intention, or the group needs to share a common object. This vagueness may cause confusion."
57,"IPC Section 326A: Whoever causes permanent or partial damage or deformity to, or burns or maims or disfigures or disables, any part or parts of the body of a person or causes grievous hurt by throwing acid on or by administering acid to that person, or by using any other means with the intention of causing or with the knowledge that he is likely to cause such injury or hurt, shall be punished with imprisonment of either description for a term which shall not be less than ten years but which may extend to imprisonment for life, and with fine: Section 326B - Explanation 2: For the purposes of section 326A and this section, permanent or partial damage or deformity shall not be required to be irreversible. changes to BNSClause 122(1): Whoever causes permanent or partial damage or deformity to, or burns or maims or disfigures or disables, any part or parts of the body of a person or causes grievous hurt by throwing acid on or by administering acid to that person, or by using any other means with the intention of causing or with the knowledge that he is likely to cause such injury or hurt or causes a person to be in a permanent vegetative state shall be punished with imprisonment of either description for a term which shall not be less than ten years but which may extend to imprisonment for life, and with fine:Explanation 2: For the purposes of this section, permanent or partial damage or deformity or permanent vegetative state, shall not be
required to be irreversible.The Implication of revision is In Explanation 2, the inclusion of permanent vegetative state absurd because the condition is permanent by definition and therefore, irreversible."
58,"IPC Section 361: Whoever takes or entices any minor under 2 [sixteen] years of age if a male, or under 3 [eighteen] years of age if a female, or any person of unsound mind, out of the keeping of the lawful guardian of such minor or person of unsound mind, without the consent of such guardian, is said to kidnap such minor or person from lawful guardianship. changes to BNSClause 135: 1) Kidnapping is of two kinds: kidnapping from India, and kidnapping from lawful guardianship (b) whoever takes or entices any child below the age of eighteen years or any person with mental illness, out of the keeping of the lawful guardian of such child or person with mental illness, without the consent of such guardian, is said to kidnap such child or person from lawful
guardianship.The Implication of revision is The difference in age between boys and girls has been now removed. Thus, kidnapping of boys between 16 to 18 years of age from lawful guardianship is now criminalised under this provision."
59,"IPC Section 363A(1): Whoever kidnaps any minor or, not being the lawful guardian of a minor, obtains the custody of the minor, in order that such minor may be employed or used for the purposes of begging shall be punishable with imprisonment of either description for a term which may extend to ten years, and shall also be liable to fine. changes to BNSClause 137(1): Whoever kidnaps any child below the age of eighteen years or, not being the lawful guardian of such child, obtains the custody of the child, in order that such child may be employed or used for the purposes of begging shall be punishable with rigorous imprisonment for a term which shall not be less than ten years but which may extend to imprisonment for life, and shall also be liable
to fine.The Implication of revision is The term minor used in the section has been replaced with child below the age of 18 years and child. The terms of punishment have been significantly increased, with the introduction of mandatory minimum sentences."
60,"IPC Section 363A(2): Whoever maims any minor in order that such minor may be employed or used for the purposes of begging shall be punishable with imprisonment for life, and shall also be liable to fine. changes to BNSClause 137(2): Whoever maims any child below the age of eighteen years in order that such child may be employed or used for the purposes of begging shall be punishable with imprisonment which shall not be less than twenty years, but which may extend to life which shall mean imprisonment for the
remainder of that persons
natural life, and with fine.The Implication of revision is Same as above."
61,"IPC Section 363A(3): Where any person, not being the lawful guardian of a minor, employs or uses such minor for the purposes of begging, it shall be presumed, unless the contrary is proved, that he kidnapped or otherwise obtained the custody of that minor in order that the minor might be employed or used for the purposes of begging. changes to BNSClause 137(3): Where any person, not being the lawful guardian of a child below the age of eighteen years employs or uses such child for the purposes of begging, it shall be presumed, unless the contrary is proved, that he kidnapped or otherwise obtained the custody of such child in order that such child might be employed or used for the
purposes of begging.The Implication of revision is Same as above."
62,"IPC Section 363A(4): In this section,
(a) begging means (i) soliciting or receiving alms in a public place, whether under the pretence of singing, dancing, fortunetelling, performing tricks or selling articles or otherwise; (ii) entering on any private premises for the purpose of soliciting or receiving alms; (iii) exposing or exhibiting, with the object of obtaining or extorting alms, any sore, wound, injury, deformity or disease, whether of himself or of any other person or of an animal;
(iv) using a minor as an exhibit for the purpose of soliciting or receiving alms; (b) minor means (i) in the case of a male, a person under sixteen years of age; and (ii) in the case of a female, a person under eighteen
years of age.] changes to BNSClause 137(4): In this section begging means(i) soliciting or receiving alms in a public place, whether under the pretence ofsinging, dancing, fortune-telling, performing tricks or selling articles or otherwise;(ii) entering on any private premises for the purpose of soliciting or receiving alms;(iii) exposing or exhibiting, with the object of obtaining or extorting alms, any sore, wound, injury, deformity or disease, whether of himself or of any other person or of an animal;(iv) using such child as an exhibit for the purpose of soliciting or receiving alms.The Implication of revision is Same as above."
63,"IPC Whoever within or without [India] conspires to commit any of the offences punishable by section 121, or conspires to overawe, by means of criminal force or the show of criminal force, [the Central Government or any [State] Government], shall be punished with [imprisonment for life], or with imprisonment of either description which may extend to ten years, [and shall also be liable to fine]. changes to BNSClause 146: Whoever within or without and beyond India conspires to commit any of the offences punishable by section 145, or conspires to overawe, by means of criminal force or the show of criminal force, the Central Government or any State Government, shall be punished with imprisonment for life, or with imprisonment of either description which may extend to ten years, and
shall also be liable to fine.The Implication of revision is Section 121A of the IPC used the phrase within or without India. This covered acts committed in India and outside India. The word beyond has now been added. It does not appear to make any difference and is hence, superfluous."
64,"IPC Section 124A: Whoever by words, either spoken or written, signs, or by visible representation, or otherwise, brings or attempts to bring into hatred or contempt, or excites or attempts to excite disaffection towards, the Government established by law  in India, shall be punished with imprisonment for life, to which fine may be added, or with imprisonment which may extend to three years, to which fine may be added, or with fine.Explanation 1.The expression disaffection includes disloyalty and all feelings of enmity.Explanation 2. Comments expressing disapprobation of the measures of the Government with a view to obtain their alteration by lawful means, without exciting or attempting to excite hatred, contempt or disaffection, do not constitute an offence under this section.Explanation 3. Comments expressing disapprobation of the administrative or other action of the Government without exciting or attempting to excite hatred, contempt or disaffection, do not constitute an offence under this
section. changes to BNSClause 150: Whoever, purposely or knowingly, by words, either spoken or written, or by signs, or by visible representation, or by electronic communication or by use of financial mean, or otherwise, excites or attempts to excite, secession or armed rebellion or subversive activities, or encourages feelings of separatist activities or endangers sovereignty or unity and integrity of India; or indulges in or commits any such act shall be punished with imprisonment for life or with imprisonment which may extend to seven years and shall also be liable to fine.Explanation -- Comments expressing disapprobation of the measures, or administrative or other action of the Government with a  view to obtain their alteration by lawful means without exciting or attempting to excite the activities referred to in this section.The Implication of revision is Although the word sedition has been removed, the new clause has wider connotations regarding acts which can now be criminalised under this provision. The use of vague phrases such as exciting secessionist activities and feelings could potentially criminalise activities which do not have any overt act. Further, the use of the word purposely introduces an ambiguous standard of mental state. The jurisprudence on sedition had limited the extent of the provision to words which lead to immediate violence. This leads to further expansion of the scope of the provision. Moreover, the explanation appears to be incomplete. However, if read as it is, it can further broaden the ambit of the section."
65,"IPC Section 131: Whoever abets the committing of mutiny by an officer, soldier, sailor or airman, in the Army, Navy or Air Force of the Government of India or attempts to seduce any such officer, soldier, sailor or airman from his allegiance or his duty, shall be punished with imprisonment for life, or with imprisonment of either description for a term which may extend to ten years, and shall also be liable to fine.
Explanation.In this section the changes to BNSClause 157: Whoever abets the committing of mutiny by an officer, soldier, sailor or airman, in the Army, Navy or Air Force subject to the Acts referred to in section 165 of the Government of India or attempts to seduce any such officer, soldier, sailor or airman from his allegiance or his duty, shall be punished with imprisonment for life, or with imprisonment of either description for a term whichThe Implication of revision is The addition made to this section reads subject to Acts referred to in section 165 of the Government of India. This is evidently erroneous, and possibly refers to Clause 165 of the BNS, and not to the Government of India."
66,"IPC No corresponding provision in the IPC changes to BNSClause 195. (1) Whoever, by words either spoken or written or by signs or by visible representations or through electronic communication or otherwise, ...(d) makes or publishes false or misleading information jeopardising the sovereignty unity and integrity
or security of India,The Implication of revision is The provision is overbroad in content and implication. It is not only criminalising publishing false/misleading information, but also making the same, which means that even speaking of certain words could be criminalised."
67,"IPC No corresponding provision in the IPC changes to BNSClause 224: Whoever attempts to commit suicide with the intent to compel or restrain any public servant from discharging his official duty shall be punished with simple imprisonment for a term which may extend to one year or with fine or with both or with community service.The Implication of revision is Section 115 of the Mental Healthcare Act, 2017 stated that any person attempting to die by suicide will be presumed to be suffering from extreme stress. They will not be prosecuted and punished under section 309 of the IPC. With section 309 no longer included in the BNS, Clause 224 draws out an exception wherein a person who attempts to die by suicide with the intent to compel or restraining a public servant from discharging their official duty shall be punished. This could include hunger strikes and other protests where death is a possible
consequence."
68,"IPC No corresponding provision in the IPC. The same text has been used in the Haryana State Amendment (2015) to section 379 and Punjab State Amendment (2014) to section 379. changes to BNSClause 302. (1) Theft is snatching if, in order to commit theft, the offender suddenly or quickly or forcibly seizes or secures or grabs or takes away from any person or from his possession any moveable property.
(2) Whoever commits snatching, shall be punished with imprisonment of either description for a term which may extend to three years, and
shall also be liable to fine.The Implication of revision is It remains unclear as to what distinguishes this offence from theft simpliciter, especially since the punishment is the same. Particularly, the phrase takes away makes it very similar to the offence of theft as defined in the previous provision."
69,"IPC Section 380: Whoever commits theft in any building, tent or vessel, which building, tent or vessel is used as a human dwelling, or used for the custody of property, shall be punished with imprisonment of either description for a term which may extend to seven years, and shall also be liable to fine. changes to BNSClause 303: Whoever commits theft
(a) in any building, tent or vessel used as a human dwelling or used for the custody of property; or
(b) of any means of transport used for the transport of goods or passengers; or
(c) of any article or goods from any means of transport used for the transport of goods or passengers; or
(d) of idol or icon in any place of worship; or
(e) of any property of the
Government or of a local authority,The Implication of revision is This clause provides for enhanced punishment for offences of theft committed in vehicles, from vehicles, theft of idols or icons from places of worship, or any property of the government or a local authority."
70,"IPC Section 401: Whoever, at any time after the passing of this Act, shall belong to any wandering or other gang of persons associated for the purpose of habitually committing theft or robbery, and not being a gang of thugs or dacoits, shall be punished with rigorous imprisonment for a term which may extend to seven years, and
shall also be liable to fine. changes to BNSClause 311: Whoever belongs to any gang of persons associated in habitually committing theft or robbery, and not being a gang of dacoits, shall be punished with rigorous imprisonment for a term which may extend to seven years, and shall also be liable to fine.The Implication of revision is The removal of the word wandering from this provision is a positive change, as it no longer implicates persons belonging to nomadic castes and communities who would otherwise be targeted and criminalised thereunder."
71,"IPC No equivalent section. changes to BNSClause 322 (3) Whoever commits mischief and thereby causes loss or damage to any property including the property of Government or Local Authority shall be punished with imprisonment of either description for a term which may extend to one year,
or with fine, or with both.The Implication of revision is The offence of mischief under the IPC had graded punishments depending on the value of the property damaged/destroyed, as well as the nature of the property damaged/destroyed. This new section specifically adds property belonging to the Government or Local Authority, and punishes the act with a maximum of one
year."
72,"IPC Sec. 427 IPC-Mischief causing damage to the amount of fifty rupees.Whoever commits mischief and
thereby causes loss or damage to the amount of fifty rupees or upwards, shall be punished with imprisonment of either description for a term which may extend to two years, or with fine,
or with both. changes to BNSClause 322 (4) Whoever commits mischief and thereby causes loss or damage to the amount of twenty thousand rupees and more but less than one lakh rupees shall be punished with imprisonment of either description for a term which may extend to two years, or with fine, or with
both.The Implication of revision is Continuing with the gradation of punishment depending on the value of damage, the BNS increases the value from Rs. 50 in the IPC to a minimum of Rs. 20,000, and up to Rs. 100,000 and provides a maximum sentence of two years."
73,"IPC No equivalent section. changes to BNSClause 322 (5) Whoever commits mischief and thereby causes loss or damage to the amount of one lakh rupees or upwards, shall be punished with imprisonment of either description for a term which may extend to five years, or
with fine, or with both.The Implication of revision is Continuing with the gradation of punishment depending on the value of damage, this newly introduced clause provides a maximum sentence of imprisonment of five years for damaging property worth over Rs. 1 lakh."
74,"IPC Sec. 428 IPC- Mischief by killing or maiming animal of the value of ten rupees.Whoever commitsmischief by killing, poisoning, maiming or rendering useless any animal or animals of the value of the tenrupees or upwards, shall be punished with imprisonment of either description for a term which may extend to two years, or with fine, or with both.
429. Mischief by killing or maiming cattle, etc., of any value or any animal of the value of fiftyrupees.Whoever commits mischief by killing, poisoning, maiming or rendering useless, changes to BNSClause 323: Whoever commits mischief by killing, poisoning, maiming or rendering useless any animal shall be punished with imprisonment of either description for a term which may extend to five years, or with fine, or with both.The Implication of revision is This section criminalises killing, poisoning, maiming or rendering useless any animal, thus possibly criminalising the killing of animals for any reason. The IPCs logic was to criminalise the killing of animals which were of value to someone, possibly covering domesticated animals killed by a third person without the consent of the owner of the animal. Clause 323, by removing the value of the animal, appears to criminalise the killing of any animal, domesticated or otherwise. In light other legislations such as the Prevention of Cruelty to Animals Act, 1960, the Wildlife Protection Act, 1972, etc., this section should have ideally been repealed."
75,"IPC Sec. 433 IPC. Mischief by destroying, moving or rendering less useful a light-house or sea- mark.
Whoever commits mischief by destroying or moving any light- house or other light used as a sea- mark, or any sea-mark or buoy or other thing placed as a guide for navigators, or by any act which renders any
such light-house, sea-mark, buoy or other such thing as aforesaid less useful as a guide for navigators,
shall be punished with imprisonment of either description for a term which may extend to seven years, or with
fine, or with both. changes to BNSClause 324: Whoever commits mischief by...(d) destroying or moving any sign or signal used for navigation of rail, aircraft or ship or other thing placed as a guide for navigators, or by any act which renders any such sign or signal less useful as a guide for navigators, shall be punished with imprisonment of either description for a term which may extend to seven years, or with fine, or with both;The Implication of revision is The section expands the scope of navigation devices originally in the IPC, which were confined to devices used in maritime navigation to include devices used for navigation in railways and in airways. Destroying a railway signal will now be covered under this section."
76,"IPC 437. Mischief with intent to destroy or make unsafe a decked vessel or one of twenty tons burden.Whoever commits mischief to any decked vessel or any vessel of a burden of twenty tons or upwards, intending to destroy or render unsafe, or knowing it to be likely that he will thereby destroy or render unsafe, that vessel, shall be punished with imprisonment of either description for a term which may extend to ten years,
and shall also be liable to fine. changes to BNSClause 325: (1) Whoever commits mischief to any rail, aircraft, or a decked vessel or any vessel of a burden of twenty tons or upwards, intending to destroy or render unsafe, or knowing it to be likely that he will thereby destroy or render unsafe, that rail, aircraft or vessel, shall be punished with imprisonment of either description for a term which may extend to ten years, and shall also be liable to fine.The Implication of revision is Section 437 of the IPC only covered decked vessels (ships). The section now covers railway vessels, and aircrafts."
77,"IPC 466. Forgery of record of Court or of public register, etc.[Whoever forges a document or an electronic record], purporting to be arecord or proceeding of or in changes to BNSClause 335: Whoever forges a document or an electronic record, purporting to be a record or proceeding of or in a Court or an identity documentThe Implication of revision is This clause now includes forging cards issued by the Government including an Aadhar card or voter identity card."
78,"IPC No equivalent provision in the IPC. changes to BNSClause 339 (3): Whoever possesses any seal, plate or other instrument knowing the same to be counterfeit, shall be punished with imprisonment of either description for a term which may extend to three years, and shall also be liable
to fine.The Implication of revision is This clause criminalises possession of seals, plates and other instrument knowing them to be counterfeit. This fills a possible void in the IPC."
79,"IPC No equivalent provision in the IPC. changes to BNSClause 339 (4): Whoever fraudulently or dishonestly uses as genuine any seal, plate or other instrument knowing or having reason to believe the same to be counterfeit, shall be punished in the same manner as if he had made or counterfeited such seal, plate
or other instrument.The Implication of revision is Continuing from the previous clause, this clause criminalises the use as genuine of a seal, plate or other instrument knowing them to be counterfeit. This fills a possible void in the IPC."
